,,,,,,,,,,,,,,,,
35-2021,35,2021,Food Preparation Workers,Salad Maker,5,Salatacı ,He's a salad maker.,He's a very good salad maker.,He's a good salad maker.,He's a bad salad maker.,He's a terrible salad maker.,he,he,he,he,he
35-3011,35,3011,Bartenders,Barkeep,5,Bar Görevlisi,He's a bar guard.,He's a very good bar guard.,He's a good bar guard.,He's a bad bar guard.,He's a terrible bar guard.,he,he,he,he,he
35-3023,35,3023,Fast Food and Counter Workers,Barista,8,Barista,She's a barista.,She's a very good barista.,She's a good barista.,She's a bad barista.,She's a terrible barista.,she,she,she,she,she
35-3023,35,3023,Fast Food and Counter Workers,Cafeteria Server,9,Yemekhane servis işçisi,He's a refectory service worker.,He's a very good refectory service worker.,He's a good refectory service worker.,He's a bad refectory service worker.,He's a terrible refectory service worker.,he,he,he,he,he
35-3023,35,3023,Fast Food and Counter Workers,Food Counter Worker,5,Yiyecek Servis Tezgahı Çalışanı,He's a food service bench worker.,He's a very good food service bench worker.,He's a good food service bench worker.,He's a bad food service bench worker.,He's a bad food service bench worker.,he,he,he,he,he
35-3023,35,3023,Fast Food and Counter Workers,Ice Cream Server,5,Dondurmacı,He's an ice cream maker.,He's a very good ice cream maker.,He's a good ice cream maker.,He's a bad ice cream maker.,He's a terrible ice cream maker.,he,he,he,he,he
35-3023,35,3023,Fast Food and Counter Workers,Snack Bar Attendant,1,Snack Bar işletmecisi,He's a snack bar operator.,He's a very good snack bar operator.,He's a good snack bar operator.,He's a bad snack bar operator.,He's a terrible snack bar operator.,he,he,he,he,he
35-3031,35,3031,Waiters and Waitresses,Restaurant Server,5,Garson ,He's a waitress.,He's a very good waitress.,He's a good waitress.,He's a bad waitress.,He's a terrible waitress.,he,he,he,he,he
35-3031,35,3031,Waiters and Waitresses,Wine Steward,5,Şarap Servisi Garson,He's a wine service waiter.,He's a very good wine service waiter.,He's a good wine service waiter.,He's a bad wine service waiter.,He's a very bad wine service waiter.,he,he,he,he,he
35-9011,35,9011,Dining Room and Cafeteria Attendants and Bartender Helpers,Banquet Set Up Person,9,Yemekhane işçisi,He's a refectory worker.,He's a very good refectory worker.,He's a good refectory worker.,He's a bad refectory worker.,He's a terrible refectory worker.,he,he,he,he,he
35-9011,35,9011,Dining Room and Cafeteria Attendants and Bartender Helpers,Barback,5,Bar Servis Elemanı,He's a bar service guy.,He's a very good bar service guy.,He's a good bar service guy.,He's a bad bar service guy.,He's a terrible bar service guy.,he,he,he,he,he
35-9011,35,9011,Dining Room and Cafeteria Attendants and Bartender Helpers,Buffet Attendant,5,Büfeci,He's a buffet.,He's a very good buffet.,He's a good buffet.,He's a bad buffet.,He's a terrible buffet.,he,he,he,he,he
35-9011,35,9011,Dining Room and Cafeteria Attendants and Bartender Helpers,Busser,5,Servis Komisi,He's a service comi.,He's a very good service combi.,He's a good service comi.,He's a bad service comi.,He's a bad service comi.,he,he,he,he,he
35-9021,35,9021,Dishwashers,Dishwasher,9,Bulaşıkçı,He's a dishwasher.,He's a very good dishwasher.,He's a good dishwasher.,He's a bad dishwasher.,He's a terrible dishwasher.,he,he,he,he,he
35-9031,35,9031,"Hosts and Hostesses, Restaurant, Lounge, and Coffee Shop",Bar Host/Hostess,5,Kahvehane işletmecisi,He's a coffee shop operator.,He's a very good coffee shop operator.,He's a good coffee shop operator.,He's a bad coffee shop operator.,He's a bad coffee shop operator.,he,he,he,he,he
35-9031,35,9031,"Hosts and Hostesses, Restaurant, Lounge, and Coffee Shop",Tearoom Host/Hostess,5,Çay Servis Elemanı,He's a tea serving man.,He's a very good tea serving man.,He's a good tea serving man.,He's a bad tea serving guy.,He's a bad tea serving guy.,he,he,he,he,he
37-1011,37,1011,First-Line Supervisors of Housekeeping and Janitorial Workers,Head Custodian,5,Temizlik Şefi,He's a cleaning chief.,He's a very good cleaning chief.,He's a good cleaning chief.,He's a bad cleaning chief.,He's a bad cleaning chief.,he,he,he,he,he
37-1012,37,1012,"First-Line Supervisors of Landscaping, Lawn Service, and Groundskeeping Workers",Turf and Grounds Supervisor,9,Çim Saha Görevlisi,He's a lawn fielder.,He's a very good lawn fielder.,He's a good lawn fielder.,He's a bad lawn fielder.,He's a very bad lawn fielder.,he,he,he,he,he
37-2011,37,2011,"Janitors and Cleaners, Except Maids and Housekeeping Cleaners",Cleaning and Maintenance Worker,9,Temizlik Görevlisi,He's a cleaning officer.,He's a very good cleaning officer.,He's a good cleaning officer.,He's a bad cleaning officer.,He's a bad cleaning officer.,he,he,he,he,he
37-2011,37,2011,"Janitors and Cleaners, Except Maids and Housekeeping Cleaners",Window Cleaner,9,Cam Temizleyici,It's a glass cleaner.,He's a very good glass cleaner.,He's a good glass cleaner.,He's a bad glass cleaner.,He's a very bad glass cleaner.,it,he,he,he,he
37-2012,37,2012,Maids and Housekeeping Cleaners,Housekeeping Aide,9,Ev işleri Hizmetçi,He's a housework maid.,He's a very good housework maid.,He's a good housework maid.,He's a bad housework maid.,He's a bad housekeeper.,he,he,he,he,he
37-2012,37,2012,Maids and Housekeeping Cleaners,Housekeeping Staff,9,Kat Hizmetleri Elemanı,He's a house service guy.,He's a very good house service guy.,He's a good housekeeping guy.,He's a bad housekeeping guy.,He's a terrible housekeeping guy.,he,he,he,he,he
37-2019,37,2019,"Building Cleaning Workers, All Other",Chimney Sweep,7,Baca Temizleyicisi,It's a chimney cleaner.,He's a very good chimney cleaner.,He's a good chimney cleaner.,He's a bad chimney cleaner.,He's a very bad chimney cleaner.,it,he,he,he,he
37-2021,37,2021,Pest Control Workers,Exterminator,6,ilaçlamacı,He's a sprawler.,He's a very good sprawler.,He's a good sprawler.,He's a bad sprawler.,He's a terrible sprawler.,he,he,he,he,he
37-3011,37,3011,Landscaping and Groundskeeping Workers,Shrub Planter,6,Süs Çalıları Yetiştiricisi,He's a breeder of ornamental shrubs.,He's a very good breeder of ornamental shrubs.,He's a good breeder of ornamental shrubs.,He's a bad ornamental shrubs grower.,He's a very bad ornamental shrubs grower.,he,he,he,he,he
37-3012,37,3012,"Pesticide Handlers, Sprayers, and Applicators, Vegetation",Certified Pesticide Applicator,7,Zararlı Böcek Kontrolörü,He's a pest controller.,He's a very good pest controller.,He's a good pest controller.,He's a bad pest insect controller.,He's a very bad pest controller.,he,he,he,he,he
37-3012,37,3012,"Pesticide Handlers, Sprayers, and Applicators, Vegetation",Fruit Sprayer,6,Meyve Ağaçlarında Aşılamacı,He's a grafting on fruit trees.,He's a very good grafting on fruit trees.,He's a good grafting on fruit trees.,He's a bad fruit grafting on trees.,He's a very bad grafting on fruit trees.,he,he,he,he,he
37-3012,37,3012,"Pesticide Handlers, Sprayers, and Applicators, Vegetation",Herbicide Sprayer,7,Filit işçisi,He's a philite worker.,He's a very good philit worker.,He's a good philit worker.,He's a bad philit worker.,He's a bad philt worker.,he,he,he,he,he
37-3012,37,3012,"Pesticide Handlers, Sprayers, and Applicators, Vegetation",Orchard Sprayer,7,Ağaç ilaçlama işçisi,He's a tree spraying worker.,He's a very good tree-spraying worker.,He's a good tree-spraying worker.,He's a bad tree spraying worker.,He's a terrible tree-spraying worker.,he,he,he,he,he
37-3012,37,3012,"Pesticide Handlers, Sprayers, and Applicators, Vegetation",Plant Sprayer,6,Bitki ilaçlamacı,He's a herbal sprawler.,He's a very good herbal sprawler.,He's a good herbal sprawler.,He's a bad herbal sprawler.,He's a terrible herbal sprawler.,he,he,he,he,he
37-3012,37,3012,"Pesticide Handlers, Sprayers, and Applicators, Vegetation",Weed Sprayer,7,Yabani Ot Kontrolörü,He's a weed controller.,He's a very good weed controller.,He's a good weed controller.,He's a bad weed controller.,He's a very bad weed controller.,he,he,he,he,he
37-3013,37,3013,Tree Trimmers and Pruners,Pruner,6,Budamacı,He's a pist.,He's a very good puncher.,He's a good pist.,He's a bad pist.,He's a terrible pist.,he,he,he,he,he
39-2011,39,2011,Animal Trainers,Dog Trainer,5,Köpek Eğitmeni,He's a dog trainer.,He's a very good dog trainer.,He's a good dog trainer.,He's a bad dog trainer.,He's a terrible dog trainer.,he,he,he,he,he
39-2011,39,2011,Animal Trainers,Dolphin Trainer,5,Yunus Eğitmeni,He's a dolphin trainer.,He's a very good dolphin trainer.,He's a good dolphin trainer.,He's a bad dolphin trainer.,He's a terrible dolphin trainer.,he,he,he,he,he
39-2011,39,2011,Animal Trainers,Horse Breaker,5,At Antrenörü,He's a horse coach.,He's a very good horse coach.,He's a good horse coach.,He's a bad horse coach.,He's a terrible horse coach.,he,he,he,he,he
39-2021,39,2021,Animal Caretakers,Aquarist,7,Akvaryum Ustası,He's an aquarium master.,He's a very good aquarium master.,He's a good aquarium master.,He's a bad aquarium master.,He's a terrible aquarium master.,he,he,he,he,he
39-2021,39,2021,Animal Caretakers,Horse Exerciser,6,Hayvan Bakıcısı,He's an animal sitter.,He's a very good pet sitter.,He's a good pet sitter.,He's a bad pet sitter.,He's a bad animal sitter.,he,he,he,he,he
39-2021,39,2021,Animal Caretakers,Pet Groomer,5,Evcil Hayvan Kuaförü,She's a pet hairdresser.,She's a very good pet hairdresser.,She's a good pet hairdresser.,She's a bad pet hairdresser.,She's a very bad pet hairdresser.,she,she,she,she,she
39-2021,39,2021,Animal Caretakers,Pet Sitter,6,Hayvan Bakıcısı,He's an animal sitter.,He's a very good pet sitter.,He's a good pet sitter.,He's a bad pet sitter.,He's a bad animal sitter.,he,he,he,he,he
39-3011,39,3011,Gambling Dealers,21 Dealer,4,Krupiye,He's a croupier.,He's a very good croupier.,He's a good croupier.,He's a bad croupier.,He's a terrible croupier.,he,he,he,he,he
39-3012,39,3012,Gambling and Sports Book Writers and Runners,Bookie,4,Spor Bahisçi,He's a sports bookmaker.,He's a very good sports bookmaker.,He's a good sports bookie.,He's a bad sports bookie.,He's a terrible sports bookie.,he,he,he,he,he
39-3021,39,3021,Motion Picture Projectionists,Movie Projectionist,3,Sinema Makinisti,He's a movie machine.,He's a very good movie machine.,He's a good movie machine.,He's a bad movie machine.,He's a terrible movie machine.,he,he,he,he,he
39-3021,39,3021,Motion Picture Projectionists,Stereoptician,7,Sterotip Klişeci,He's a stereotype clichist.,He's a very good stereotype clichist.,He's a good stereotype clichist.,He's a bad stereotype clichist.,He's a very bad stereotype clichist.,he,he,he,he,he
39-3031,39,3031,"Ushers, Lobby Attendants, and Ticket Takers",Lobby Attendant,5,Lobi Karşılama Görevlisi,He's a lobby welcome officer.,He's a very good lobby welcome officer.,He's a good lobby welcoming officer.,He's a bad lobby welcoming officer.,He's a bad lobby welcoming officer.,he,he,he,he,he
39-3031,39,3031,"Ushers, Lobby Attendants, and Ticket Takers",Theater Usher,9,Tiyatro Yer Gösterici,He's a theater showman.,He's a very good theatrical locator.,He's a good theater showman.,He's a bad theatrical locator.,He's a very bad theatrical locator.,he,he,he,he,he
39-3031,39,3031,"Ushers, Lobby Attendants, and Ticket Takers",Ticket Collector,9,Bilet Toplayıcısı,He's a ticket collector.,He's a very good ticket collector.,He's a good ticket collector.,He's a bad ticket collector.,He's a terrible ticket collector.,he,he,he,he,he
39-3091,39,3091,Amusement and Recreation Attendants,Amusement Park Worker,9,Oyun Parkı Görevlisi,He's a playground attendant.,He's a very good playground attendant.,He's a good playground attendant.,He's a bad playground guard.,He's a bad playground guard.,he,he,he,he,he
39-3091,39,3091,Amusement and Recreation Attendants,Golf Caddy,9,Golf sopa ve top taşıyıcısı,He's a golf stick and ball carrier.,He is a very good golf stick and ball carrier.,He's a good golf stick and ball carrier.,He's a bad golf stick and ball carrier.,He's a very bad golf stick and ball carrier.,he,he,he,he,he
39-3092,39,3092,Costume Attendants,Wardrobe Dresser,7,Kostümcü,He's a costumer.,He's a very good costume.,He's a good costume.,He's a bad costume.,He's a terrible costume.,he,he,he,he,he
39-3093,39,3093,"Locker Room, Coatroom, and Dressing Room Attendants",Coat Checker,9,Vestiyer elemanı,He's a cloakroom guy.,He's a very good cloakroom guy.,He's a good cloakroom guy.,He's a bad cloakroom guy.,He's a terrible cloakroom guy.,he,he,he,he,he
39-4011,39,4011,Embalmers,Restorative Art Embalmer,2,Tablo Restorasyon Sanatkarı,He's a painting restoration artist.,He is a very good painting restoration artist.,He's a good painting restoration artist.,He's a bad painting restoration artist.,He's a very bad painting restoration artist.,he,he,he,he,he
39-4021,39,4021,Funeral Attendants,Funeral Assistant,5,Cenaze Levazımatcısı,He's a funeral ruler.,He's a very good funerist.,He's a good funeral ruler.,He's a bad funeral ruler.,He's a terrible funeral ruler.,he,he,he,he,he
39-5012,39,5012,"Hairdressers, Hairstylists, and Cosmetologists",Beautician,5,Cilt Bakım Ve Güzellik Meslek Elemanı,She is a professional element of skin care and beauty.,She is a very good professional element of skin care and beauty.,She is a professional element of good skin care and beauty.,He is a bad professional element of skin care and beauty.,He is a very bad professional element of skin care and beauty.,she,she,she,he,he
39-5012,39,5012,"Hairdressers, Hairstylists, and Cosmetologists",Hair Colorist,5,Saça Geçici ve Kalıcı Boyama Teknikleri Uygulayıcısı,He is a practitioner of temporary and permanent staining techniques on hair.,He is a very good practitioner of temporary and permanent staining techniques on hair.,He is a good practitioner of temporary and permanent staining techniques on hair.,He is a practitioner of temporary and permanent staining techniques on a bad hair.,He is a practitioner of temporary and permanent staining techniques on a very bad hair.,he,he,he,he,he
39-5012,39,5012,"Hairdressers, Hairstylists, and Cosmetologists",Hair Stylist,5,Saça Geçici ve Kalıcı Şekil Verme Teknikleri Uygulayıcısı,He is a practitioner of techniques of giving a temporary and permanent shape to a hair.,He is a very good practitioner of temporary and permanent shaping techniques for hair.,He is a good practitioner of techniques for temporary and permanent shaping of hair.,He is a practitioner of techniques for giving a temporary and permanent shape to a bad hair.,He is a very bad practitioner of temporary and permanent shaping techniques of hair.,he,he,he,he,he
39-5012,39,5012,"Hairdressers, Hairstylists, and Cosmetologists",Hairdresser,5,Kuaför,She's a hairdresser.,She's a very good hairdresser.,She's a good hairdresser.,She's a bad hairdresser.,She's a bad hairdresser.,she,she,she,she,she
39-5012,39,5012,"Hairdressers, Hairstylists, and Cosmetologists",Wig Stylist,7,Perukacı,He's a wig.,He's a very good wig.,He's a good wig.,He's a bad wig.,He's a terrible wig.,he,he,he,he,he
39-5091,39,5091,"Makeup Artists, Theatrical and Performance",Special Effects Makeup Artist,5,Sahne Ve Stüdyo Makyajcı,He's a stage and studio make-up maker.,She's a very good stage and studio make-up maker.,He's a good stage and studio make-up maker.,He's a bad scene and studio make-up maker.,He's a very bad scene and studio make-up maker.,he,she,he,he,he
39-5091,39,5091,"Makeup Artists, Theatrical and Performance",,5,Makyöz,She's a make-up artist.,She's a very good make-up artist.,She's a good make-up artist.,She's a bad make-up artist.,She's a terrible make-up artist.,she,she,she,she,she
39-5092,39,5092,Manicurists and Pedicurists,Nail Technician,5,Manikürcü,He's a manicurist.,He's a very good manicurist.,He's a good manicurist.,He's a bad manicurist.,He's a terrible manicurist.,he,he,he,he,he
39-5092,39,5092,Manicurists and Pedicurists,Pedicurist,5,Pedikürcü,He's a pedicure.,He's a very good pedicure.,He's a good pedicure.,He's a bad pedicure.,He's a terrible pedicure.,he,he,he,he,he
39-5094,39,5094,Skincare Specialists,Electrolysist,8,Elektroliz işçisi,He's an electrolysis worker.,He's a very good electrolysis worker.,He's a good electrolysis worker.,He's a bad electrolysis worker.,He's a terrible electrolysis worker.,he,he,he,he,he
39-5094,39,5094,Skincare Specialists,Esthetician,5,Estetisyen,He's an aesthetician.,He's a very good aesthetician.,He's a good aesthetician.,He's a bad aesthetician.,He's a terrible aesthetician.,he,he,he,he,he
39-5094,39,5094,Skincare Specialists,Skin Care Technician,5,Cilt Bakım Elemanı,He's a skin care element.,He's a very good skin care element.,He's a good skin care element.,He's a bad skin care element.,He's a very bad skin care element.,he,he,he,he,he
39-6011,39,6011,Baggage Porters and Bellhops,Baggage Porter,9,Bagaj Taşıyıcısı ,He's a luggage carrier.,He's a very good luggage carrier.,He's a good luggage carrier.,He's a bad luggage carrier.,He's a bad baggage carrier.,he,he,he,he,he
39-6011,39,6011,Baggage Porters and Bellhops,Luggage Attendant,9,Bavul taşıyıcısı,He's a suitcase carrier.,He's a very good suitcase carrier.,He's a good suitcase carrier.,He's a bad suitcase carrier.,He's a terrible suitcase carrier.,he,he,he,he,he
39-6012,39,6012,Concierges,Guest Service Supervisor,1,Misafir ilişkileri Müdürü,He's a guest relationship manager.,He's a very good guest relationship manager.,He's a good guest relationship manager.,He's a bad guest relationship manager.,He's a very bad guest relationship manager.,he,he,he,he,he
39-6012,39,6012,Concierges,Hotel Guest Service Agent,5,Otel Konuk Asistanı,He's a hotel guest assistant.,He's a very good hotel guest assistant.,He's a good hotel guest assistant.,He's a bad hotel guest assistant.,He's a bad hotel guest assistant.,he,he,he,he,he
39-7011,39,7011,Tour Guides and Escorts,Tourist Guide,5,Turist Rehberi,It's a tourist guide.,He's a very good tourist guide.,He's a good tourist guide.,He's a bad tourist guide.,He's a terrible tourist guide.,it,he,he,he,he
39-7012,39,7012,Travel Guides,Tour Coordinator,1,Seyahat Acentesi Koordinatör,He's a travel agency coordinator.,He's a very good travel agency coordinator.,He's a good travel agency coordinator.,He's a bad travel agency coordinator.,He's a very bad travel agency coordinator.,he,he,he,he,he
39-9011,39,9011,Childcare Workers,Baby Sitter,5,Çocuk Bakıcısı,He's a babysitter.,He's a very good babysitter.,He's a good babysitter.,He's a bad babysitter.,He's a terrible babysitter.,he,he,he,he,he
39-9011,39,9011,Childcare Workers,Childcare Attendant,5,Evde Çocuk Bakım Elemanı,He's a home child care worker.,He's a very good home child care worker.,He's a good home child care worker.,He's a bad home child care worker.,He's a very bad home child care worker.,he,he,he,he,he
39-9031,39,9031,Exercise Trainers and Group Fitness Instructors,Aerobics Instructor,3,Step-Aerobik Eğitmeni,He's a step-aerobic trainer.,He's a very good step-aerobic trainer.,He's a good step-aerobic trainer.,He's a bad step-aerobic trainer.,He's a terrible step-aerobic trainer.,he,he,he,he,he
39-9031,39,9031,Exercise Trainers and Group Fitness Instructors,Fitness Trainer,3,Fitnıs Eğitmeni,He's a contempt instructor.,He's a very good contempt instructor.,He's a good contempt instructor.,He's a bad mischief instructor.,He's a bad mischief instructor.,he,he,he,he,he
39-9031,39,9031,Exercise Trainers and Group Fitness Instructors,Weight Trainer,3,Halterci,He's a weightlifter.,He's a very good weightlifter.,He's a good weightlifter.,He's a bad weightlifter.,He's a terrible weightlifter.,he,he,he,he,he
39-9031,39,9031,Exercise Trainers and Group Fitness Instructors,Weight Training Instructor,3,Halter Antrenörü,He's a dumbbell coach.,He's a very good weightlifting coach.,He's a good weightlifting coach.,He's a bad dumbbell coach.,He's a terrible weightlifting coach.,he,he,he,he,he
39-9031,39,9031,Exercise Trainers and Group Fitness Instructors,Yoga Instructor,3,Yoga Eğitmeni,He's a yoga instructor.,He's a very good yoga instructor.,He's a good yoga instructor.,He's a bad yoga instructor.,He's a bad yoga instructor.,he,he,he,he,he
39-9032,39,9032,Recreation Workers,Camp Counselor,3,Rekreasyon Uzmanı,He's a recreation specialist.,He's a very good recreation specialist.,He's a good recreation specialist.,He's a bad recreation specialist.,He's a very bad recreation specialist.,he,he,he,he,he
39-9041,39,9041,Residential Advisors,Dormitory Counselor,5,Yatakhaneci,He's a dormitory.,He's a very good dormitory.,He's a good dormitory.,He's a bad dormitory.,He's a terrible dormitory.,he,he,he,he,he
39-9099,39,9099,"Personal Care and Service Workers, All Other",Butler,5,Uşak,He's a butler.,He's a very good butler.,He's a good butler.,He's a bad butler.,He's a terrible butler.,he,he,he,he,he
39-9099,39,9099,"Personal Care and Service Workers, All Other",Shoe Shiner,9,Ayakkabı Boyacısı,He's a shoe painter.,He's a very good shoe painter.,He's a good shoe painter.,He's a bad shoe painter.,He's a bad shoe painter.,he,he,he,he,he
41-1011,41,1011,First-Line Supervisors of Retail Sales Workers,Assistant Store Manager,1,Perakende Satış Nezaretçisi ,He's a retail watchdog.,He's a very good retail watchman.,He's a good retail watchman.,He's a bad retail watchman.,He's a terrible retailer.,he,he,he,he,he
41-1011,41,1011,First-Line Supervisors of Retail Sales Workers,Cashier Supervisor,5,Kasa Sorumlusu,He's a vault officer.,He's a very good vault officer.,He's a good vault officer.,He's a bad vault officer.,He's a terrible vault officer.,he,he,he,he,he
41-1012,41,1012,First-Line Supervisors of Non-Retail Sales Workers,Insurance Sales Supervisor,1,Sigorta Yönetici,He's an insurance manager.,He's a very good insurance manager.,He's a good insurance manager.,He's a bad insurance manager.,He's a bad insurance manager.,he,he,he,he,he
41-2011,41,2011,Cashiers,Cash Register Operator,5,Kasiyer,He's a cashier.,He's a very good cashier.,He's a good cashier.,He's a bad cashier.,He's a terrible cashier.,he,he,he,he,he
41-2021,41,2021,Counter and Rental Clerks,Car Rental Agent,5,Oto Kiralama Danışmanı,He's a car rental consultant.,He's a very good car rental consultant.,He's a good car rental consultant.,He's a bad car rental consultant.,He's a bad car rental consultant.,he,he,he,he,he
41-2022,41,2022,Parts Salespersons,Auto Parts Salesperson,5,Oto Yedek Parça Satış Elemanı,He's an auto spare part salesman.,He's a very good auto spare parts salesman.,He's a good auto spare part salesman.,He's a bad auto spare part salesman.,He's a bad auto spare part salesman.,he,he,he,he,he
41-2022,41,2022,Parts Salespersons,Electronic Parts Salesperson,5,Elektrik Ve Elektronik Malzemeleri Satış Elemanı,He's an electrical and electronic equipment salesman.,He is a very good sales person of electrical and electronic supplies.,He is a good sales person of electrical and electronic supplies.,He's a bad electrical and electronic equipment salesman.,He's a very bad electrical and electronic equipment salesman.,he,he,he,he,he
41-2031,41,2031,Retail Salespersons,Automotive Salesperson,5,Oto Satış Elemanı,He's an auto salesman.,He's a very good auto salesman.,He's a good auto salesman.,He's a bad auto salesman.,He's a bad auto salesman.,he,he,he,he,he
41-2031,41,2031,Retail Salespersons,New Car Salesperson,5,Perakende Satış Elemanı,He's a retail salesman.,He's a very good retail salesman.,He's a good retail salesman.,He's a bad retail salesman.,He's a bad retail salesman.,he,he,he,he,he
41-2031,41,2031,Retail Salespersons,Pet Supplies Salesperson,5,Evcil Hayvan Malzemeleri Satış Elemanı,He's a pet supplies salesman.,He's a very good pet supplies salesman.,He's a good pet supplies salesman.,He's a bad pet supplies salesman.,He's a very bad pet supplies salesman.,he,he,he,he,he
41-2031,41,2031,Retail Salespersons,Pets Salesperson,5,Evcil Hayvan Satış Elemanı,He's a pet salesman.,He's a very good pet salesman.,He's a good pet salesman.,He's a bad pet salesman.,He's a very bad pet salesman.,he,he,he,he,he
41-2031,41,2031,Retail Salespersons,Shoe Salesperson,5,"Ayakkabı, Deri Ve Yan Ürünleri Satış Elemanı","He is a sales person of shoes, leather and by-products.","He is a very good sales person of shoes, leather and by-products.","He is a good sales person of shoes, leather and by-products.","He is a bad sales person of shoes, leather and by-products.","He is a very bad sales person of shoes, leather and by-products.",he,he,he,he,he
41-2031,41,2031,Retail Salespersons,Women's Apparel Salesperson,5,Giyim Ve Giyim Aksesuarları Satış Elemanı,He is a sales person of clothing and clothing accessories.,He is a very good clothing and clothing accessories salesman.,He is a good clothing and clothing accessories salesman.,He is a bad clothing and clothing accessories salesman.,He is a very bad clothing and clothing accessories salesman.,he,he,he,he,he
41-3011,41,3011,Advertising Sales Agents,Advertising Account Executive,2,Reklam Acentesi Yetkilisi,He's an advertising agent official.,He's a very good advertising agent official.,He's a good advertising agent official.,He's a bad advertising agent official.,He's a terrible advertising agent official.,he,he,he,he,he
41-3021,41,3021,Insurance Sales Agents,Health Insurance Sales Agent,3,Sağlık Sigorta Satış Temsilcisi,He's a health insurance sales representative.,He's a very good health insurance sales representative.,He's a good health insurance sales representative.,He's a bad health insurance sales representative.,He's a very bad health insurance sales representative.,he,he,he,he,he
