,,,,,,,,,,,,,,,,
25-1011,25,1011,"Business Teachers, Postsecondary",Banking and Finance Instructor,2,Finansman Öğretmeni,He's a finance teacher.,He's a very good finance teacher.,He's a good finance teacher.,He's a bad finance teacher.,He's a terrible finance teacher.,he,he,he,he,he
25-1011,25,1011,"Business Teachers, Postsecondary",Finance Professor,2,iktisat Öğretim Üyesi,He's an economics lecturer.,He's a very good economics lecturer.,He's a good economics lecturer.,He's a bad economics lecturer.,He's a bad economics lecturer.,he,he,he,he,he
25-1011,25,1011,"Business Teachers, Postsecondary",Marketing Instructor,2,Pazarlama Öğretmeni,He's a marketing teacher.,He's a very good marketing teacher.,He's a good marketing teacher.,He's a bad marketing teacher.,He's a terrible marketing teacher.,he,he,he,he,he
25-1021,25,1021,"Computer Science Teachers, Postsecondary",Computer Information Systems Professor,2,Bilgisayar Bilimleri Öğretim Üyesi,He's a computer science lecturer.,He's a very good computer science lecturer.,He's a good computer science lecturer.,He's a bad computer science lecturer.,He's a very bad computer science lecturer.,he,he,he,he,he
25-1021,25,1021,"Computer Science Teachers, Postsecondary",Computer Programming Professor,2,Bilgisayar Yazılımı Öğretim Üyesi,He's a computer software lecturer.,He's a very good computer software lecturer.,He's a good computer software lecturer.,He's a bad computer software lecturer.,He's a very bad computer software lecturer.,he,he,he,he,he
25-1021,25,1021,"Computer Science Teachers, Postsecondary",Information Technology Professor,2,Bilişim Teknolojileri Öğretmeni,He's an IT teacher.,He's a very good information technology teacher.,He's a good information technology teacher.,He's a bad IT teacher.,He's a bad information technology teacher.,he,he,he,he,he
25-1022,25,1022,"Mathematical Science Teachers, Postsecondary",Mathematics Professor,2,Matematik Öğretim Üyesi,He's a math lecturer.,He's a very good math lecturer.,He's a good math lecturer.,He's a bad math lecturer.,He's a bad math lecturer.,he,he,he,he,he
25-1031,25,1031,"Architecture Teachers, Postsecondary",Architectural Design Professor,2,Yapı Tasarım Öğretmeni,He's a building design teacher.,He's a very good building design teacher.,He's a good building design teacher.,He's a bad building design teacher.,He's a very bad building design teacher.,he,he,he,he,he
25-1031,25,1031,"Architecture Teachers, Postsecondary",Architecture Professor,2,Mimarlık Öğretim Üyesi,He's an architectural lecturer.,He's a very good architectural lecturer.,He's a good architectural lecturer.,He's a bad architectural lecturer.,He's a bad architectural lecturer.,he,he,he,he,he
25-1031,25,1031,"Architecture Teachers, Postsecondary",Interior Design Professor,2,iç Mekan Dekorasyon Öğretmeni,She's an interior decoration teacher.,She is a very good interior decoration teacher.,He's a good interior decoration teacher.,He's a bad interior decoration teacher.,He's a very bad interior decoration teacher.,she,she,he,he,he
25-1032,25,1032,"Engineering Teachers, Postsecondary",Chemical Engineering Professor,2,Kimya Mühendisliği Öğretim Üyesi,He's a chemical engineering lecturer.,He's a very good chemical engineering lecturer.,He's a good chemical engineering lecturer.,He's a bad chemical engineering lecturer.,He's a bad chemical engineering lecturer.,he,he,he,he,he
25-1032,25,1032,"Engineering Teachers, Postsecondary",Civil Engineering Professor,2,inşaat Mühendisliği Öğretim Üyesi,He's a civil engineering lecturer.,He's a very good civil engineering lecturer.,He's a good civil engineering lecturer.,He's a bad civil engineering lecturer.,He's a bad civil engineering lecturer.,he,he,he,he,he
25-1032,25,1032,"Engineering Teachers, Postsecondary",Electrical Engineering Professor,2,Elektrik Mühendisliği Öğretim Üyesi,He's an electrical engineering lecturer.,He's a very good electrical engineering lecturer.,He's a good electrical engineering lecturer.,He's a bad electrical engineering lecturer.,He's a bad electrical engineering lecturer.,he,he,he,he,he
25-1032,25,1032,"Engineering Teachers, Postsecondary",Electronics Engineering Professor,2,Elektronik Mühendisliği Öğretim Üyesi,He's an electronic engineering lecturer.,He's a very good lecturer in electronics engineering.,He's a good electronics engineering lecturer.,He's a bad electronics engineering lecturer.,He's a bad electronics engineering lecturer.,he,he,he,he,he
25-1032,25,1032,"Engineering Teachers, Postsecondary",Industrial Engineering Professor,2,Endüstri Mühendisliği Öğretim Üyesi,He's an industrial engineering lecturer.,He's a very good industrial engineering lecturer.,He's a good industrial engineering lecturer.,He's a bad industrial engineering lecturer.,He's a bad industrial engineering lecturer.,he,he,he,he,he
25-1032,25,1032,"Engineering Teachers, Postsecondary",Manufacturing Engineering Professor,2,Malzeme Ve Üretim Teknolojisi Öğretim Üyesi,He is a lecturer in materials and manufacturing technology.,He is a very good material and manufacturing technology lecturer.,He is a good material and manufacturing technology lecturer.,He's a bad material and a lecturer in manufacturing technology.,He's a very bad material and manufacturing technology lecturer.,he,he,he,he,he
25-1032,25,1032,"Engineering Teachers, Postsecondary",Marine Engineering Professor,2,Gemi Makineleri işletme Mühendisliği Öğretim Üyesi,He's a ship machinery business engineering lecturer.,He is a very good ship machinery business engineering lecturer.,He's a good ship machinery business engineering lecturer.,He's a bad ship machinery business engineering lecturer.,He's a very bad ship machinery business engineering lecturer.,he,he,he,he,he
25-1032,25,1032,"Engineering Teachers, Postsecondary",Mechanical Engineering Professor,2,Makine Mühendisliği Öğretim Üyesi,He's a mechanical engineering lecturer.,He's a very good mechanical engineering lecturer.,He's a good mechanical engineering lecturer.,He's a bad mechanical engineering lecturer.,He's a bad mechanical engineering lecturer.,he,he,he,he,he
25-1041,25,1041,"Agricultural Sciences Teachers, Postsecondary",Agricultural Soil Conservation Professor,2,Ziraat Bilimleri Öğretim Üyesi,He's an agricultural sciences lecturer.,He's a very good agricultural sciences lecturer.,He's a good agricultural sciences lecturer.,He's a bad agricultural sciences lecturer.,He's a very bad agricultural sciences lecturer.,he,he,he,he,he
25-1041,25,1041,"Agricultural Sciences Teachers, Postsecondary",Aquaculture and Fisheries Professor,2,Su Ürünleri Öğretmeni,He's a seafood teacher.,He's a very good teacher of aquaculture.,He's a good teacher of aquaculture.,He's a bad seafood teacher.,He's a terrible aquaculture teacher.,he,he,he,he,he
25-1042,25,1042,"Biological Science Teachers, Postsecondary",Biochemistry Professor,2,Biyokimya Öğretim Üyesi,He's a biochemistry lecturer.,He's a very good biochemistry lecturer.,He's a good biochemistry lecturer.,He's a bad biochemistry lecturer.,He's a bad biochemistry lecturer.,he,he,he,he,he
25-1042,25,1042,"Biological Science Teachers, Postsecondary",Botany Professor,2,Botanik Öğretim Üyesi,He's a botanical lecturer.,He's a very good botanical lecturer.,He's a good botanical lecturer.,He's a bad botanical lecturer.,He's a bad botanical lecturer.,he,he,he,he,he
25-1042,25,1042,"Biological Science Teachers, Postsecondary",Embryology Professor,2,Biyoloji Öğretim Üyesi,He's a biology lecturer.,He's a very good biology lecturer.,He's a good biology lecturer.,He's a bad biology lecturer.,He's a bad biology lecturer.,he,he,he,he,he
25-1042,25,1042,"Biological Science Teachers, Postsecondary",Zoology Professor,2,Zooloji Öğretim Üyesi,He's a zoology lecturer.,He's a very good zoology lecturer.,He's a good zoology lecturer.,He's a bad zoology lecturer.,He's a terrible zoology lecturer.,he,he,he,he,he
25-1043,25,1043,"Forestry and Conservation Science Teachers, Postsecondary",Ecology Professor,2,Ekoloji Öğretim Üyesi,He's an ecology lecturer.,He's a very good ecology lecturer.,He's a good ecology lecturer.,He's a bad ecology lecturer.,He's a bad ecology lecturer.,he,he,he,he,he
25-1043,25,1043,"Forestry and Conservation Science Teachers, Postsecondary",Environmental Conservation Professor,2,Çevre Bilimleri Öğretim Üyesi,He's an environmental sciences faculty member.,He's a very good environmental science lecturer.,He's a good environmental science lecturer.,He's a bad environmental science lecturer.,He's a very bad environmental science lecturer.,he,he,he,he,he
25-1051,25,1051,"Atmospheric, Earth, Marine, and Space Sciences Teachers, Postsecondary",Geology Professor,2,Genel Jeoloji Öğretim Üyesi,He's a general geology lecturer.,He's a very good general geology lecturer.,He's a good general geology lecturer.,He's a bad general geology lecturer.,He's a bad general geology lecturer.,he,he,he,he,he
25-1051,25,1051,"Atmospheric, Earth, Marine, and Space Sciences Teachers, Postsecondary",Meteorology Professor,2,Meteoroloji Öğretmeni,He's a meteorological teacher.,He's a very good meteorological teacher.,He's a good meteorological teacher.,He's a bad meteorological teacher.,He's a terrible meteorological teacher.,he,he,he,he,he
25-1051,25,1051,"Atmospheric, Earth, Marine, and Space Sciences Teachers, Postsecondary",Mineralogy Professor,2,Mineraloji Ve Petrografi Öğretim Üyesi,He's a mineralogy and petrography lecturer.,He is a very good mineralogy and petrography lecturer.,He's a good mineralogy and petrography lecturer.,He's a bad mineralogy and petrography lecturer.,He's a very bad mineralogy and petrography lecturer.,he,he,he,he,he
25-1052,25,1052,"Chemistry Teachers, Postsecondary",Chemistry Professor,2,Analitik Kimya Öğretim Üyesi,He's an analytical chemistry lecturer.,He's a very good analytical chemistry lecturer.,He's a good analytical chemistry lecturer.,He's a bad analytical chemistry lecturer.,He's a bad analytical chemistry lecturer.,he,he,he,he,he
25-1053,25,1053,"Environmental Science Teachers, Postsecondary",Environmental Science Professor,2,Çevre Bilimleri Öğretim Üyesi,He's an environmental sciences faculty member.,He's a very good environmental science lecturer.,He's a good environmental science lecturer.,He's a bad environmental science lecturer.,He's a very bad environmental science lecturer.,he,he,he,he,he
25-1054,25,1054,"Physics Teachers, Postsecondary",Aerodynamics Professor,2,Fizik Bilimi Öğretim Üyesi,He's a physics lecturer.,He's a very good physics lecturer.,He's a good physics lecturer.,He's a bad physics lecturer.,He's a bad physics lecturer.,he,he,he,he,he
25-1054,25,1054,"Physics Teachers, Postsecondary",Thermodynamics Professor,2,Termodinamik Ve Enerji Öğretim Üyesi,He's a thermodynamics and energy lecturer.,He's a very good thermodynamics and energy lecturer.,He's a good thermodynamics and energy lecturer.,He's a bad thermodynamics and energy lecturer.,He's a very bad thermodynamics and energy lecturer.,he,he,he,he,he
25-1061,25,1061,"Anthropology and Archeology Teachers, Postsecondary",Cultural Anthropology Professor,2,Antropoloji Öğretim Üyesi,He's an anthropology lecturer.,He's a very good anthropology lecturer.,He's a good anthropology lecturer.,He's a bad anthropology lecturer.,He's a bad anthropology lecturer.,he,he,he,he,he
25-1061,25,1061,"Anthropology and Archeology Teachers, Postsecondary",Near East Archeology Professor,2,Arkeoloji Öğretim Üyesi,He's an archaeology lecturer.,He's a very good archaeology lecturer.,He's a good archaeology lecturer.,He's a bad archaeology lecturer.,He's a bad archaeology lecturer.,he,he,he,he,he
25-1061,25,1061,"Anthropology and Archeology Teachers, Postsecondary",Sociocultural Anthropology Professor,2,Sosyal (Kültürel) Antropoloji Öğretim Üyesi,He is a social (cultural) anthropology lecturer.,He is a very good social (cultural) anthropology lecturer.,He is a good social (cultural) anthropology lecturer.,He is a bad social (cultural) anthropology lecturer.,He is a very bad social (cultural) anthropology lecturer.,he,he,he,he,he
25-1062,25,1062,"Area, Ethnic, and Cultural Studies Teachers, Postsecondary",Ethnology Professor,2,Etnoloji Öğretim Üyesi,He's an ethnology lecturer.,He's a very good ethnology lecturer.,He's a good ethnology lecturer.,He's a bad ethnology lecturer.,He's a very bad ethnology lecturer.,he,he,he,he,he
25-1063,25,1063,"Economics Teachers, Postsecondary",Agricultural Economics Professor,2,Ekonomi Ve Ticaret Öğretim Üyesi,He's an economics and commerce lecturer.,He is a very good lecturer in economics and commerce.,He's a good economics and commerce lecturer.,He's a bad economics and commerce lecturer.,He's a very bad economics and commerce lecturer.,he,he,he,he,he
25-1064,25,1064,"Geography Teachers, Postsecondary",Cartography Professor,2,Kartoğrafya Öğretim Üyesi,He's a cartography lecturer.,He's a very good cartography lecturer.,He's a good cartography lecturer.,He's a bad cartography lecturer.,He's a bad cartography lecturer.,he,he,he,he,he
25-1064,25,1064,"Geography Teachers, Postsecondary",Geographic Information Systems Professor,2,Coğrafya Öğretim Üyesi,He's a geography lecturer.,He's a very good geography lecturer.,He's a good geography lecturer.,He's a bad geography lecturer.,He's a bad geography lecturer.,he,he,he,he,he
25-1064,25,1064,"Geography Teachers, Postsecondary",GIS Professor,2,Coğrafi Bilgi Sistemleri Öğretim Üyesi,He is a geographical information systems lecturer.,He is a very good geographic information systems lecturer.,He's a good geographic information systems lecturer.,He's a bad geographic information systems lecturer.,He's a very bad geographic information systems lecturer.,he,he,he,he,he
25-1065,25,1065,"Political Science Teachers, Postsecondary",International Relations Professor,2,Uluslararası ilişkiler Öğretim Üyesi,He's an international relations faculty member.,He is a very good international relations lecturer.,He's a good international relations lecturer.,He's a bad international relations lecturer.,He's a very bad international relations lecturer.,he,he,he,he,he
25-1066,25,1066,"Psychology Teachers, Postsecondary",Child Development Professor,2,Çocuk Gelişimi Ve Eğitimi Öğretim Üyesi,She is a child development and education lecturer.,She is a very good child development and education lecturer.,He is a good child development and education lecturer.,He is a bad child development and education lecturer.,He is a very bad child development and education lecturer.,she,she,he,he,he
25-1066,25,1066,"Psychology Teachers, Postsecondary",Clinical Psychology Professor,2,Klinik Psikoloji Öğretim Üyesi,He's a clinical psychology lecturer.,He's a very good clinical psychology lecturer.,He's a good clinical psychology lecturer.,He's a bad clinical psychology lecturer.,He's a very bad clinical psychology lecturer.,he,he,he,he,he
25-1066,25,1066,"Psychology Teachers, Postsecondary",Human Relations Professor,2,Sosyal Psikoloji Öğretim Üyesi,He's a social psychology lecturer.,He's a very good social psychology lecturer.,He's a good social psychology lecturer.,He's a bad social psychology lecturer.,He's a very bad social psychology lecturer.,he,he,he,he,he
25-1066,25,1066,"Psychology Teachers, Postsecondary",Psychology Professor,2,Psikoloji Öğretim Görevlisi,He's a psychology lecturer.,He's a very good psychology lecturer.,He's a good psychology lecturer.,He's a bad psychology lecturer.,He's a bad psychology lecturer.,he,he,he,he,he
25-1067,25,1067,"Sociology Teachers, Postsecondary",Comparative Sociology Professor,2,Sosyoloji Öğretim Üyesi,He's a sociology lecturer.,He's a very good sociology lecturer.,He's a good sociology lecturer.,He's a bad sociology lecturer.,He's a bad sociology lecturer.,he,he,he,he,he
25-1067,25,1067,"Sociology Teachers, Postsecondary",Social Organization Professor,2,Kurumlar Sosyolojisi Öğretim Üyesi,He's a lecturer in sociology of institutions.,He is a very good sociology lecturer in institutions.,He's a good institutional-sociology lecturer.,He's a bad sociology lecturer.,He's a very bad sociology lecturer.,he,he,he,he,he
25-1071,25,1071,"Health Specialties Teachers, Postsecondary",Dentistry Professor,2,Dişçilik Öğretim Üyesi,He's a dentistry lecturer.,He's a very good dentistry lecturer.,He's a good dentistry lecturer.,He's a bad dentistry lecturer.,He's a bad dentistry lecturer.,he,he,he,he,he
25-1071,25,1071,"Health Specialties Teachers, Postsecondary",Pharmacology Professor,2,Farmakoloji Öğretim Üyesi,He's a pharmacology lecturer.,He's a very good pharmacology lecturer.,He's a good pharmacology lecturer.,He's a bad pharmacology lecturer.,He's a very bad pharmacology lecturer.,he,he,he,he,he
25-1072,25,1072,"Nursing Instructors and Teachers, Postsecondary",Advanced Nursing Professor,2,Yüksek Hemşirelik Okulu Öğretim Üyesi,He's a higher nursing school lecturer.,She's a very good high nursing school lecturer.,He's a good higher nursing school lecturer.,He's a bad high nursing school lecturer.,He's a very bad high nursing school lecturer.,he,she,he,he,he
25-1072,25,1072,"Nursing Instructors and Teachers, Postsecondary",Registered Nursing Professor,2,Hemşirelik Öğretmeni,He's a nursing teacher.,He's a very good nursing teacher.,He's a good nursing teacher.,He's a bad nursing teacher.,He's a terrible nursing teacher.,he,he,he,he,he
25-1082,25,1082,"Library Science Teachers, Postsecondary",Library and Information Science Professor,2,Kütüphanecilik Öğretmeni,He's a librarian teacher.,He's a very good librarian teacher.,He's a good librarian teacher.,He's a bad librarian teacher.,He's a terrible librarian teacher.,he,he,he,he,he
25-1111,25,1111,"Criminal Justice and Law Enforcement Teachers, Postsecondary",Criminal Justice Professor,2,Adalet Öğretmeni,He's a justice teacher.,He's a very good justice teacher.,He's a good justice teacher.,He's a bad justice teacher.,He's a terrible justice teacher.,he,he,he,he,he
25-1112,25,1112,"Law Teachers, Postsecondary",Constitutional Law Professor,2,Hukuk ilmi Öğretim Üyesi,He's a law science lecturer.,He's a very good law lecturer.,He's a good law lecturer.,He's a bad law lecturer.,He's a bad law lecturer.,he,he,he,he,he
25-1121,25,1121,"Art, Drama, and Music Teachers, Postsecondary",Ballet Professor,2,Drama Öğretmeni ,He's a drama teacher.,He's a very good drama teacher.,He's a good drama teacher.,He's a bad drama teacher.,He's a terrible drama teacher.,he,he,he,he,he
25-1121,25,1121,"Art, Drama, and Music Teachers, Postsecondary",Graphic Design Professor,2,Grafik Öğretmeni,He's a graphic teacher.,He's a very good graphic teacher.,He's a good graphic teacher.,He's a bad graphic teacher.,He's a terrible graphic teacher.,he,he,he,he,he
25-1121,25,1121,"Art, Drama, and Music Teachers, Postsecondary",Photography Professor,2,Fotoğraf Öğretmeni,He's a photography teacher.,He's a very good photography teacher.,He's a good photography teacher.,He's a bad photography teacher.,He's a terrible photography teacher.,he,he,he,he,he
25-1121,25,1121,"Art, Drama, and Music Teachers, Postsecondary",Piano Performance and Pedagogy Professor,2,Piyano Sanat Dalı Öğretim Üyesi,He's a piano art lecturer.,He's a very good piano art lecturer.,He's a good piano art lecturer.,He's a bad piano art lecturer.,He's a very bad piano art lecturer.,he,he,he,he,he
25-1121,25,1121,"Art, Drama, and Music Teachers, Postsecondary",Piano Professor,2,Piyano Eğitmeni,He's a piano instructor.,He's a very good piano instructor.,He's a good piano instructor.,He's a bad piano instructor.,He's a terrible piano instructor.,he,he,he,he,he
25-1122,25,1122,"Communications Teachers, Postsecondary",Journalism Professor,2,Gazetecilik Ve Halkla ilişkiler Öğretmeni,He's a journalism and public relations teacher.,He's a very good journalism and public relations teacher.,He's a good journalism and public relations teacher.,He's a bad journalism and public relations teacher.,He's a terrible journalism and public relations teacher.,he,he,he,he,he
25-1123,25,1123,"English Language and Literature Teachers, Postsecondary",Children's Literature Professor,2,ingiliz Dili Ve Edebiyatı Öğretim Üyesi,He's an English language and literature lecturer.,He's a very good English language and literature lecturer.,He's a good English language and literature lecturer.,He's a bad English language and literature lecturer.,He's a very bad English language and literature lecturer.,he,he,he,he,he
25-1123,25,1123,"English Language and Literature Teachers, Postsecondary",Composition Professor,2,Dil Ve Edebiyat Öğretim Üyesi,He's a lecturer in language and literature.,He is a very good lecturer in language and literature.,He's a good lecturer in language and literature.,He's a bad language and a lecturer in literature.,He's a very bad language and literature lecturer.,he,he,he,he,he
25-1124,25,1124,"Foreign Language and Literature Teachers, Postsecondary",Arabic Professor,2,Arap Dili Ve Edebiyatı Öğretim Üyesi,He's an Arabic language and literature lecturer.,He is a very good professor of Arabic language and literature.,He's a good Arabic language and literature lecturer.,He's a bad Arabic language and literature lecturer.,He's a very bad Arabic language and literature lecturer.,he,he,he,he,he
25-1124,25,1124,"Foreign Language and Literature Teachers, Postsecondary",Chinese Language Professor,2,Çince Öğretmeni,He's a Chinese teacher.,He's a very good Chinese teacher.,He's a good chinese teacher.,He's a bad Chinese teacher.,He's a terrible Chinese teacher.,he,he,he,he,he
25-1124,25,1124,"Foreign Language and Literature Teachers, Postsecondary",French Professor,2,Fransız Dili Ve Edebiyatı Öğretim Üyesi,He's a French language and literature lecturer.,He is a very good lecturer in French language and literature.,He's a good lecturer in French language and literature.,He's a bad French language and literature lecturer.,He's a very bad lecturer in French language and literature.,he,he,he,he,he
25-1124,25,1124,"Foreign Language and Literature Teachers, Postsecondary",German Professor,2,Alman Dili Ve Edebiyatı Öğretim Üyesi,He's a German language and literature lecturer.,He's a very good German language and literature lecturer.,He's a good German language and literature lecturer.,He's a bad German language and literature lecturer.,He's a very bad German language and literature lecturer.,he,he,he,he,he
25-1124,25,1124,"Foreign Language and Literature Teachers, Postsecondary",Greek Professor,2,Yunan Dili Ve Edebiyatı Öğretim Üyesi,He is a Greek language and literature lecturer.,He is a very good lecturer in Greek language and literature.,He's a good Greek language and literature lecturer.,He's a bad Greek language and literature lecturer.,He's a very bad Greek language and literature lecturer.,he,he,he,he,he
25-1124,25,1124,"Foreign Language and Literature Teachers, Postsecondary",Japanese Professor,2,Japon Dili Ve Edebiyatı Öğretim Üyesi,He's a lecturer in Japanese language and literature.,He is a very good lecturer in Japanese language and literature.,He's a good lecturer in Japanese language and literature.,He's a bad Japanese language and literature lecturer.,He's a very bad Japanese language and literature lecturer.,he,he,he,he,he
25-1124,25,1124,"Foreign Language and Literature Teachers, Postsecondary",Russian Language Professor,2,Rus Dili Ve Edebiyatı Öğretim Üyesi,He is a lecturer in Russian language and literature.,He is a very good lecturer in Russian language and literature.,He is a good lecturer in Russian language and literature.,He is a bad Russian language and a lecturer in literature.,He is a very bad Russian language and literature lecturer.,he,he,he,he,he
25-1124,25,1124,"Foreign Language and Literature Teachers, Postsecondary",Spanish Literature Professor,2,ispanyol Dili Ve Edebiyatı Öğretim Üyesi,He's a Spanish language and literature lecturer.,He is a very good lecturer in Spanish language and literature.,He's a good Spanish language and literature lecturer.,He's a bad Spanish language and literature lecturer.,He's a very bad Spanish language and literature lecturer.,he,he,he,he,he
25-1125,25,1125,"History Teachers, Postsecondary",African History Professor,2,Tarih Öğretim Üyesi,He's a history lecturer.,He's a very good history lecturer.,He's a good history lecturer.,He's a bad history lecturer.,He's a terrible history lecturer.,he,he,he,he,he
25-1126,25,1126,"Philosophy and Religion Teachers, Postsecondary",Biblical Studies Professor,2,Felsefe Öğretim Üyesi,He's a philosophy lecturer.,He's a very good philosophy lecturer.,He's a good philosophy lecturer.,He's a bad philosophy lecturer.,He's a bad philosophy lecturer.,he,he,he,he,he
25-1192,25,1192,"Family and Consumer Sciences Teachers, Postsecondary",Family and Consumer Sciences Professor,2,Aile Ve Tüketici Bilimleri Öğretmeni,He's a family and consumer science teacher.,He is a very good family and consumer science teacher.,He's a good family and consumer science teacher.,He's a bad family and consumer science teacher.,He's a very bad family and consumer science teacher.,he,he,he,he,he
25-1192,25,1192,"Family and Consumer Sciences Teachers, Postsecondary",Home and Family Living Professor,2,Ev idaresi Bilimi Öğretmeni,He's a home administration science teacher.,He's a very good home administration science teacher.,He's a good home administration science teacher.,He's a bad home administration science teacher.,He's a bad home administration science teacher.,he,he,he,he,he
