,,,,,,,,,,,,,,,,
,,,,,,,,,,,,,,,,
2018 SOC Code (US),Major Code,Minor Code,2018 SOC Title (US),2018 SOC Direct Match Title (US),ISCO Major Code (TR),ISCO Minor Code (TR),Translation (AWS),,,,,,,,,
,,,,,,,translation,,,,,gender,,,,
,,,,,,,O bir ,çok iyi,iyi,kötü,çok kötü,O bir ,çok iyi,iyi,kötü,çok kötü
11-1011,11,1011,Chief Executives,Admiral,1,Oramiral,He's an oradmiral.,He's a very good oradmiral.,He's a good oradmiral.,He's a bad oradmiral.,He's a bad oradmiral.,he,he,he,he,he
11-1011,11,1011,Chief Executives,Chief Executive Officer,1,Tepe Yönetici-icra Kurulu Başkanı,He is the head of a hill manager-executive board.,He is a very good hill manager-executive chairman.,He's a good hill manager-executive chairman.,He's a bad hill manager-executive chairman.,He's a very bad hill manager-executive chairman.,he,he,he,he,he
11-1011,11,1011,Chief Executives,Chief Financial Officer,1,Tepe Yönetici-Mali işlerden Sorumlu,He's a hill manager-responsible for financial affairs.,He is a very good hill manager-responsible for financial affairs.,He is a good hill manager-responsible for financial affairs.,He's a bad hill manager-responsible for financial affairs.,He's a very bad hill manager-responsible for financial affairs.,he,he,he,he,he
11-1011,11,1011,Chief Executives,Governor,1,Vali,He's a governor.,He's a very good governor.,He's a good governor.,He's a bad governor.,He's a terrible governor.,he,he,he,he,he
11-1011,11,1011,Chief Executives,Mayor,1,Belediye Başkanı,He's a mayor.,He's a very good mayor.,He's a good mayor.,He's a bad mayor.,He's a terrible mayor.,he,he,he,he,he
11-1011,11,1011,Chief Executives,University President,1,Rektör,He's a rector.,He's a very good rector.,He's a good rector.,He's a bad rector.,He's a terrible rector.,he,he,he,he,he
11-1021,11,1021,General and Operations Managers,Department Store Manager,1,Mağaza Müdürü,He's a store manager.,He's a very good store manager.,He's a good store manager.,He's a bad store manager.,He's a terrible store manager.,he,he,he,he,he
11-1021,11,1021,General and Operations Managers,General Manager,1,Genel Müdür,He's a general manager.,He's a very good general manager.,He's a good general manager.,He's a bad general manager.,He's a terrible general manager.,he,he,he,he,he
11-1021,11,1021,General and Operations Managers,Operations Manager,1,Operasyon Yöneticisi,He's an operations manager.,He's a very good operations manager.,He's a good operations manager.,He's a bad operations manager.,He's a terrible operations manager.,he,he,he,he,he
11-1031,11,1031,Legislators,Senator,1,Milletvekili,He's a deputy.,He's a very good deputy.,He's a good deputy.,He's a bad deputy.,He's a terrible deputy.,he,he,he,he,he
11-2011,11,2011,Advertising and Promotions Managers,Advertising Manager,1,Reklam Yönetici,He's an advertising manager.,He's a very good advertising manager.,He's a good advertising manager.,He's a bad advertising manager.,He's a very bad advertising manager.,he,he,he,he,he
11-2021,11,2021,Marketing Managers,Marketing Manager,1,Pazarlama Müdürü,He's a marketing manager.,He's a very good marketing manager.,He's a good marketing manager.,He's a bad marketing manager.,He's a terrible marketing manager.,he,he,he,he,he
11-2022,11,2022,Sales Managers,Export Manager,1,ithalat-ihracat Müdürü,He's an import-export manager.,He's a very good import-export manager.,He's a good import-export manager.,He's a bad import-export manager.,He's a very bad import-export manager.,he,he,he,he,he
11-2022,11,2022,Sales Managers,Sales Manager,1,Satış Müdürü,He's a sales manager.,He's a very good sales manager.,He's a good sales manager.,He's a bad sales manager.,He's a bad sales manager.,he,he,he,he,he
11-2032,11,2032,Public Relations Managers,Communication Manager,1,Haberleşme Yönetici,He's a communications manager.,He's a very good communications manager.,He's a good communications manager.,He's a bad communications manager.,He's a bad communications manager.,he,he,he,he,he
11-2032,11,2032,Public Relations Managers,Public Relations Manager,1,Halkla ilişkiler Yönetici,He's a public relations manager.,He's a very good PR manager.,He's a good PR manager.,He's a bad PR manager.,He's a very bad PR manager.,he,he,he,he,he
11-2033,11,2033,Fundraising Managers,Foundation Director,1,Vakıf Müdürü,He's a foundation manager.,He's a very good foundation manager.,He's a good foundation manager.,He's a bad foundation manager.,He's a terrible foundation manager.,he,he,he,he,he
11-3012,11,3012,Administrative Services Managers,Business Unit Manager,3,Birim Sorumlusu,He's a unit in charge.,He's a very good unit in charge.,He's a good unit in charge.,He's a bad unit in charge.,He's a very bad unit in charge.,he,he,he,he,he
11-3012,11,3012,Administrative Services Managers,Records and Information Manager,4,Kayıt Memuru,He's a registrar.,He's a very good registrar.,He's a good registrar.,He's a bad registrar.,He's a terrible registrar.,he,he,he,he,he
11-3012,11,3012,Administrative Services Managers,Administrative Services Manager,1,idari işler Müdürü,He's a manager of administrative affairs.,He's a very good manager of administrative affairs.,He's a good manager of administrative affairs.,He's a bad administrative director.,He's a terrible administrative director.,he,he,he,he,he
11-3013,11,3013,Facilities Managers,Facility Manager,1,Tesis Yöneticisi,He's a facility manager.,He's a very good facility manager.,He's a good facility manager.,He's a bad facility manager.,He's a bad facility manager.,he,he,he,he,he
11-3013,11,3013,Facilities Managers,Stadium Manager,5,Stadyum Görevlisi,He's a stadium guard.,He's a very good stadium guard.,He's a good stadium guard.,He's a bad stadium guard.,He's a terrible stadium guard.,he,he,he,he,he
11-3021,11,3021,Computer and Information Systems Managers,Computer Operations Manager,3,Sistem işletme Sorumlusu,He's a system operating officer.,He's a very good system operating officer.,He's a good system operating officer.,He's a bad system operating officer.,He's a very bad system operating officer.,he,he,he,he,he
11-3021,11,3021,Computer and Information Systems Managers,Information Systems Manager,1,Bilgi işlem Yönetici,He's a computing manager.,He's a very good computing manager.,He's a good computing manager.,He's a bad computing administrator.,He's a very bad computing administrator.,he,he,he,he,he
11-3021,11,3021,Computer and Information Systems Managers,Information Technology Director,1,Bilgi Teknolojileri (BT) Müdürü,He is a director of information technology (IT).,He is a very good director of information technology (IT).,He is a good director of information technology (IT).,He is a bad information technology (IT) manager.,He is a very bad director of information technology (IT).,he,he,he,he,he
11-3021,11,3021,Computer and Information Systems Managers,Management Information Systems Director,2,Yönetim Bilişim Sistemleri Uzmanı,He's a management IT specialist.,He's a very good management IT specialist.,He's a good management IT specialist.,He's a bad management IT expert.,He's a bad management IT expert.,he,he,he,he,he
11-3031,11,3031,Financial Managers,Bank Branch Manager,1,Şube Müdürü,He's a branch manager.,He's a very good branch manager.,He's a good branch manager.,He's a bad branch manager.,He's a bad branch manager.,he,he,he,he,he
11-3031,11,3031,Financial Managers,Banking Manager,1,Banka Müdürü,He's a bank manager.,He's a very good bank manager.,He's a good bank manager.,He's a bad bank manager.,He's a bad bank manager.,he,he,he,he,he
11-3031,11,3031,Financial Managers,City Treasurer,1,Hazine Müdürü,He's a treasure manager.,He's a very good treasure manager.,He's a good treasure manager.,He's a bad treasure manager.,He's a terrible treasure manager.,he,he,he,he,he
11-3031,11,3031,Financial Managers,Credit Manager,1,Kredi Müdürü,He's a loan manager.,He's a very good credit manager.,He's a good credit manager.,He's a bad credit manager.,He's a bad credit manager.,he,he,he,he,he
11-3031,11,3031,Financial Managers,Financial Director,1,Finans Müdürü,He's a finance manager.,He's a very good financial manager.,He's a good financial manager.,He's a bad financial manager.,He's a terrible financial manager.,he,he,he,he,he
11-3031,11,3031,Financial Managers,Financial Officer,2,Finansman Sorumlusu,He's a finance officer.,He's a very good finance officer.,He's a good finance officer.,He's a bad financing officer.,He's a very bad financing officer.,he,he,he,he,he
11-3031,11,3031,Financial Managers,Fiscal Manager,1,Bütçe Müdürü,He's a budget manager.,He's a very good budget manager.,He's a good budget manager.,He's a bad budget manager.,He's a terrible budget manager.,he,he,he,he,he
11-3051,11,3051,Industrial Production Managers,Manufacturing Director,1,imalat Sanayi Üretim Müdürü,He is a manufacturing industry production director.,He is a very good manufacturing industry production director.,He is a good manufacturing industry production director.,He is a bad manufacturing industry production director.,He is a very bad manufacturing industry production director.,he,he,he,he,he
11-3051,11,3051,Industrial Production Managers,Plant Manager,1,Fabrika Müdürü,He's a factory manager.,He's a very good factory manager.,He's a good factory manager.,He's a bad factory manager.,He's a bad factory manager.,he,he,he,he,he
11-3061,11,3061,Purchasing Managers,Contracting Manager,1,Sözleşme Yöneticisi,He's a contract manager.,He's a very good contract manager.,He's a good contract manager.,He's a bad contract manager.,He's a terrible contract manager.,he,he,he,he,he
11-3061,11,3061,Purchasing Managers,Purchasing Director,1,Satın Alma müdürü,He's a purchasing manager.,He's a very good purchasing manager.,He's a good purchasing manager.,He's a bad purchasing manager.,He's a bad purchasing manager.,he,he,he,he,he
11-3071,11,3071,"Transportation, Storage, and Distribution Managers",Airport Manager,1,Liman işletme Müdürü,He's a port operating manager.,He's a very good port operating manager.,He's a good port business manager.,He's a bad port business manager.,He's a bad port business manager.,he,he,he,he,he
11-3071,11,3071,"Transportation, Storage, and Distribution Managers",Cold Storage Supervisor,9,Soğuk Hava Depo Görevlisi,He's a cold storage officer.,He's a very good cold storage officer.,He's a good cold storage officer.,He's a bad cold storage officer.,He's a terrible cold storage officer.,he,he,he,he,he
11-3071,11,3071,"Transportation, Storage, and Distribution Managers",Distribution Center Manager,1,Dağıtım Müdürü,He's a distribution manager.,He's a very good distribution manager.,He's a good distribution manager.,He's a bad distribution manager.,He's a terrible distribution manager.,he,he,he,he,he
11-3071,11,3071,"Transportation, Storage, and Distribution Managers",Logistics Manager,1,Lojistik Operasyon Yöneticisi,He's a logistics operations manager.,He's a very good logistics operations manager.,He's a good logistics operations manager.,He's a bad logistics operations manager.,He's a bad logistics operations manager.,he,he,he,he,he
11-3071,11,3071,"Transportation, Storage, and Distribution Managers",Transportation Manager,1,Ulaşım Yönetici,He's a transportation manager.,He's a very good transport manager.,He's a good transport manager.,He's a bad transportation manager.,He's a very bad transport manager.,he,he,he,he,he
11-3071,11,3071,"Transportation, Storage, and Distribution Managers",Warehouse Manager,1,Ardiye Yönetici,He's a succarious manager.,He's a very good succarious manager.,He's a good succarious manager.,He's a bad suitor.,He's a terrible succarious manager.,he,he,he,he,he
11-3111,11,3111,Compensation and Benefits Managers,Wage and Salary Administrator,2,Ücret Ve Yan Haklar Uzmanı,He's a fee and a subsidiary rights expert.,He is a very good fee and side rights expert.,He's a good fee and side rights expert.,He's a bad fee and a side-rights expert.,He's a very bad fee and side rights expert.,he,he,he,he,he
11-3121,11,3121,Human Resources Managers,Personnel Manager,1,Personel işleri Yönetici,He's a staff affairs manager.,He's a very good staff job manager.,He's a good staff affairs manager.,He's a bad staff affairs manager.,He's a very bad staff affairs manager.,he,he,he,he,he
11-3121,11,3121,Human Resources Managers,Human Resources Manager,1,insan Kaynakları Müdürü,He's a human resources manager.,He's a very good human resources manager.,He's a good human resources manager.,He's a bad human resources manager.,He's a bad human resources manager.,he,he,he,he,he
11-9013,11,9013,"Farmers, Ranchers, and Other Agricultural Managers",Animal Husbandry Manager,1,Hayvancılık işletme Yöneticisi,He's a livestock business manager.,He's a very good animal husbandry business manager.,He's a good animal husbandry business manager.,He's a bad animal husbandry business manager.,He's a bad animal husbandry business manager.,he,he,he,he,he
11-9013,11,9013,"Farmers, Ranchers, and Other Agricultural Managers",Farm Manager,1,Çiftlik Yöneticisi,He's a farm manager.,He's a very good farm manager.,He's a good farm manager.,He's a bad farm manager.,He's a bad farm manager.,he,he,he,he,he
11-9021,11,9021,Construction Managers,Construction Coordinator,1,inşaat Koordinatör,He's a construction coordinator.,He's a very good construction coordinator.,He's a good construction coordinator.,He's a bad construction coordinator.,He's a very bad construction coordinator.,he,he,he,he,he
11-9021,11,9021,Construction Managers,Construction Superintendent,3,inşaat Şantiye Şefi,He's a construction site chief.,He's a very good construction site chief.,He's a good construction site chief.,He's a bad construction site chief.,He's a very bad construction site chief.,he,he,he,he,he
11-9021,11,9021,Construction Managers,General Contractor,1,Müteahhit,He's a contractor.,He's a very good contractor.,He's a good contractor.,He's a bad contractor.,He's a terrible contractor.,he,he,he,he,he
11-9021,11,9021,Construction Managers,Masonry Contractor Administrator,3,Beton Tesis Şefi,He's a concrete plant chief.,He's a very good concrete plant chief.,He's a good concrete plant chief.,He's a bad concrete plant chief.,He's a very bad concrete plant chief.,he,he,he,he,he
11-9031,11,9031,"Education and Childcare Administrators, Preschool and Day Care",Childcare Center Director,1,Çocuk Bakım Hizmet Müdürü,He's a child care manager.,He's a very good child care manager.,He's a good child care manager.,He's a bad child care manager.,He's a very bad child care manager.,he,he,he,he,he
11-9031,11,9031,"Education and Childcare Administrators, Preschool and Day Care",,1,Anaokulu Müdür,He's a kindergarten manager.,He's a very good kindergarten manager.,He's a good kindergarten manager.,He's a bad kindergarten manager.,He's a bad kindergarten manager.,he,he,he,he,he
11-9032,11,9032,"Education Administrators, Kindergarten through Secondary",K-12 School Principal,1,Okul Müdürü,He's a school principal.,He's a very good school principal.,He's a good school principal.,He's a bad school principal.,He's a terrible school principal.,he,he,he,he,he
11-9033,11,9033,"Education Administrators, Postsecondary",Education Administrator,1,Eğitim Yöneticisi,He's an education manager.,He's a very good education manager.,He's a good education manager.,He's a bad education manager.,He's a very bad education manager.,he,he,he,he,he
11-9033,11,9033,"Education Administrators, Postsecondary",University Dean,1,Dekan,He's a dean.,He's a very good dean.,He's a good dean.,He's a bad dean.,He's a terrible dean.,he,he,he,he,he
11-9051,11,9051,Food Service Managers,Food and Beverage Manager,1,Yiyecek içecek Müdürü,He's a director of food and drink.,He's a very good food and drink manager.,He's a good food and drink manager.,He's a bad food and drink manager.,He's a bad food and drink manager.,he,he,he,he,he
11-9051,11,9051,Food Service Managers,Restaurant General Manager,1,Lokanta Genel Müdür,He's a restaurant general manager.,He's a very good restaurant general manager.,He's a good restaurant general manager.,He's a bad restaurant general manager.,He's a bad restaurant general manager.,he,he,he,he,he
11-9051,11,9051,Food Service Managers,Tavern Operator,1,"Kafe, Bar Ve Snack Bar işletmecisi","He's a cafe, bar and snack bar operator.","He is a very good cafe, bar and snack bar operator.","He's a good cafe, bar and snack bar operator.","He's a bad cafe, bar and snack bar operator.","He's a very bad cafe, bar and snack bar operator.",he,he,he,he,he
11-9072,11,9072,"Entertainment and Recreation Managers, Except Gambling",Fitness Club Manager,1,Spor Tesisi Yöneticisi,He's a sports facility manager.,He's a very good sports facility manager.,He's a good sports facility manager.,He's a bad sports facility manager.,He's a very bad sports facility manager.,he,he,he,he,he
11-9081,11,9081,Lodging Managers,Boardinghouse Keeper,1,Pansiyon işletmecisi,He's a boarding operator.,He's a very good hostel operator.,He's a good hostel operator.,He's a bad boarding operator.,He's a bad hostel operator.,he,he,he,he,he
11-9081,11,9081,Lodging Managers,Hotel Manager,1,Otel Müdürü,He's a hotel manager.,He's a very good hotel manager.,He's a good hotel manager.,He's a bad hotel manager.,He's a bad hotel manager.,he,he,he,he,he
11-9081,11,9081,Lodging Managers,Lodging Facilities Manager,1,Konaklama Hizmetleri Yöneticileri,He's a accommodation services managers.,He is a very good accommodation service managers.,He is a good accommodation service managers.,He's a bad accommodation service managers.,He's a very bad accommodation service managers.,he,he,he,he,he
11-9111,11,9111,Medical and Health Services Managers,Healthcare Administrator,1,Sağlık Kurumu işletmecisi,He's a medical institution operator.,He's a very good medical institution operator.,He's a good healthcare provider.,He's a bad medical institution operator.,He's a bad medical institution operator.,he,he,he,he,he
11-9111,11,9111,Medical and Health Services Managers,Healthcare Manager,1,Sağlık Yöneticisi,He's a health manager.,He's a very good health manager.,He's a good health manager.,He's a bad health manager.,He's a bad health manager.,he,he,he,he,he
11-9111,11,9111,Medical and Health Services Managers,Hospice Director,1,Hasta Bakımevi Müdürü,He's a nursing home manager.,He's a very good nursing home manager.,He's a good nursing home manager.,He's a bad nursing home manager.,He's a bad nursing home manager.,he,he,he,he,he
11-9111,11,9111,Medical and Health Services Managers,Medical Director,1,Tıbbi Direktör,He's a medical director.,He's a very good medical director.,He's a good medical director.,He's a bad medical director.,He's a terrible medical director.,he,he,he,he,he
11-9111,11,9111,Medical and Health Services Managers,Medical Records Administrator,3,Tıbbi Kayıt Süpervizörü,He's a medical record supervisor.,He's a very good medical record supervisor.,He's a good medical record supervisor.,He's a bad medical record supervisor.,He's a terrible medical record supervisor.,he,he,he,he,he
11-9111,11,9111,Medical and Health Services Managers,Nursing Home Manager,1,Huzurevi Müdürü,He's a nursing home manager.,He's a very good nursing home manager.,He's a good nursing home manager.,He's a bad nursing home manager.,He's a bad nursing home manager.,he,he,he,he,he
11-9111,11,9111,Medical and Health Services Managers,Nursing Service Director,1,Yaşlı Bakım Hizmetleri Müdürü,He's an elder care manager.,He's a very good elder care manager.,He's a good elder care manager.,He's a bad old care manager.,He's a very bad old care manager.,he,he,he,he,he
11-9131,11,9131,Postmasters and Mail Superintendents,Postal Supervisor,4,Posta Servis Nezaretçisi,He's a postal service overseer.,He's a very good postal service overseer.,He's a good postal service overseer.,He's a bad mail service overseer.,He's a bad mail service overseer.,he,he,he,he,he
11-9131,11,9131,Postmasters and Mail Superintendents,Postmaster,4,Posta Şefi,He's a post chief.,He's a very good post chief.,He's a good post chief.,He's a bad post chief.,He's a terrible post chief.,he,he,he,he,he
11-9141,11,9141,"Property, Real Estate, and Community Association Managers",Apartment Manager,5,Apartman idarecisi,He's an apartment manager.,He's a very good apartment manager.,He's a good apartment manager.,He's a bad apartment manager.,He's a bad apartment manager.,he,he,he,he,he
11-9141,11,9141,"Property, Real Estate, and Community Association Managers",Real Estate Manager,1,Gayrimenkul işleri Yönetici,He's a real estate business manager.,He is a very good real estate business manager.,He's a good real estate business manager.,He's a bad real estate business manager.,He's a very bad real estate business manager.,he,he,he,he,he
11-9151,11,9151,Social and Community Service Managers,Family Service Center Director,1,Aile Hizmetleri Müdürü,He's a manager of family services.,He's a very good family service manager.,He's a good family service manager.,He's a bad family service manager.,He's a bad family service manager.,he,he,he,he,he
11-9151,11,9151,Social and Community Service Managers,Social Service Director,1,Sosyal Yardım Müdürü,He's an outreach manager.,He's a very good outreach manager.,He's a good outreach manager.,He's a bad outreach manager.,He's a bad outreach manager.,he,he,he,he,he
11-9151,11,9151,Social and Community Service Managers,Youth Program Director,3,Gençlik ve Spor Uzmanı,He's a youth and sports expert.,He is a very good youth and sports specialist.,He is a good youth and sports specialist.,He's a bad youth and sports expert.,He's a very bad youth and sports expert.,he,he,he,he,he
11-9161,11,9161,Emergency Management Directors,Director of Civil Defense,5,Sivil Savunma Amiri,He's a civil defense supervisor.,He's a very good civil defense supervisor.,He's a good civil defense supervisor.,He's a bad civil defense supervisor.,He's a terrible civil defense supervisor.,he,he,he,he,he
11-9161,11,9161,Emergency Management Directors,Disaster Response Director,1,Afet ve Acil Durum Yönetimi Başkanı,He's a disaster and head of emergency management.,He's a very good disaster and head of emergency management.,He's a good disaster and head of emergency management.,He's a bad disaster and head of emergency management.,He's a very bad disaster and head of emergency management.,he,he,he,he,he
11-9161,11,9161,Emergency Management Directors,Emergency Management Director,3,Acil Yardım ve Afet Yöneticisi,He's an emergency aid and disaster manager.,He's a very good emergency aid and disaster manager.,He's a good emergency and disaster manager.,He's a bad emergency aid and disaster manager.,He's a very bad emergency aid and disaster manager.,he,he,he,he,he
11-9179,11,9179,"Personal Service Managers, All Other",Day Spa Director,1,SPA Merkezi Müdürü,He's the director of a spa center.,He's a very good spa manager.,He's a good spa manager.,He's a bad spa manager.,He's a bad spa manager.,he,he,he,he,he
13-1023,13,1023,"Purchasing Agents, Except Wholesale, Retail, and Farm Products",Purchasing Agent,3,Satın Alma Görevlisi,He's a purchaser.,He's a very good purchaser.,He's a good purchaser.,He's a bad purchaser.,He's a bad purchaser.,he,he,he,he,he
13-1032,13,1032,"Insurance Appraisers, Auto Damage",Auto Damage Insurance Appraiser,3,Motorlu Kara Taşıtları Sigorta Eksperi,He's a motor vehicle insurance expert.,He's a very good motor vehicle insurance expert.,He's a good motor vehicle insurance expert.,He's a bad motor vehicle insurance expert.,He's a very bad motor vehicle insurance expert.,he,he,he,he,he
13-1041,13,1041,Compliance Officers,License Inspector,3,Ruhsat  Memuru,He's a license officer.,He's a very good license officer.,He's a good license officer.,He's a bad license officer.,He's a terrible license officer.,he,he,he,he,he
13-1071,13,1071,Human Resources Specialists,Corporate Recruiter,2,işe Alım Uzmanı,He's a recruitment specialist.,He's a very good recruitment specialist.,He's a good recruitment specialist.,He's a bad recruitment expert.,He's a terrible recruitment expert.,he,he,he,he,he
13-1071,13,1071,Human Resources Specialists,Employee Placement Specialist,2,istihdam Uzmanı,He's an employment specialist.,He's a very good employment specialist.,He's a good employment specialist.,He's a bad employment expert.,He's a bad employment expert.,he,he,he,he,he
13-1071,13,1071,Human Resources Specialists,Human Resources Generalist,4,insan Kaynakları Yönetimi Meslek Elemanı,He's a professional in human resources management.,He is a very good human resource management professional.,He's a good human resource management professional.,He's a bad human resource management professional.,He's a very bad human resource management professional.,he,he,he,he,he
13-1071,13,1071,Human Resources Specialists,Personnel Specialist,2,Personel Uzmanı,He's a staff expert.,He's a very good staff specialist.,He's a good staff expert.,He's a bad staff expert.,He's a bad staff expert.,he,he,he,he,he
13-1071,13,1071,Human Resources Specialists,Human Resources Specialist,2,insan Kaynakları Uzmanı,He's a human resources expert.,He's a very good human resources expert.,He's a good human resources expert.,He's a bad human resources expert.,He's a bad human resources expert.,he,he,he,he,he
13-1075,13,1075,Labor Relations Specialists,Industrial Relations Specialist,2,Endüstri ilişkileri Uzmanı,He's an industrial relations expert.,He's a very good industrial relations expert.,He's a good industrial relations expert.,He's a bad industry relations expert.,He's a very bad industrial relations expert.,he,he,he,he,he
